{
  "schemaVersion": 1,
  "catalogId": "0f1a3647a21da391f5b3c032c24b00f94c9916c3f0d3c9eaa1da78d8065a7d0d",
  "entries": [
    {
      "role": "baseline-oracle-gate-result",
      "digest": "0129c0cf5b0bceada1b78c58b5058ac3f20b880d13cca6bb48d9e22e23aa325a",
      "contentModel": "canonical-json",
      "mediaType": "application/json",
      "contentSha256": "511a7ef64bf3471a9f354655a512aca59f6bb18d18002a4e4016e5ee450e8679",
      "availability": "bundled",
      "logicalPath": "repo://investigations/backend-agnostic-goal-closure/material/baseline-oracle-gate-final-result-selected-term-paths-agree.json",
      "resolverId": "repo-v1"
    },
    {
      "role": "baseline-oracle-gate-result",
      "digest": "0a8ab9c0c1ec1ae7d988675408df239ba43e9013326cdbcee85130446dafab95",
      "contentModel": "canonical-json",
      "mediaType": "application/json",
      "contentSha256": "b14e80b7c2b436c18c88b12784013ea2e17d80b720db5f8465ee30dd02e99ea0",
      "availability": "bundled",
      "logicalPath": "repo://investigations/backend-agnostic-goal-closure/material/baseline-oracle-gate-final-result-selected-term-paths-distinguish.json",
      "resolverId": "repo-v1"
    },
    {
      "role": "baseline-oracle-gate-result",
      "digest": "130db533d8547dc97310aa94d642231178324bd7e92f33bfed199191daf4d577",
      "contentModel": "canonical-json",
      "mediaType": "application/json",
      "contentSha256": "7cecb7c7754d0a6a8d58394222559a907ed802bb6682a6a6e590c06a831a6f66",
      "availability": "bundled",
      "logicalPath": "repo://investigations/backend-agnostic-goal-closure/material/baseline-oracle-gate-reachability-reachability-truth-distinguish.json",
      "resolverId": "repo-v1"
    },
    {
      "role": "baseline-oracle-gate-result",
      "digest": "14c40ba5cdfde1c75cdf6ed07aea573efa04b77740eac71d7e3f6a98427b188e",
      "contentModel": "canonical-json",
      "mediaType": "application/json",
      "contentSha256": "3617c9e8e98363992bf8b4e2af8c2889dda5ac533c663f4efb893f8ebfdd1f53",
      "availability": "bundled",
      "logicalPath": "repo://investigations/backend-agnostic-goal-closure/material/baseline-oracle-gate-execution-pattern-pattern-outcome-distinguish.json",
      "resolverId": "repo-v1"
    },
    {
      "role": "baseline-oracle-gate-result",
      "digest": "172a86b9816e790859905d0ae16cb432e0e65b2118bdef2fa43326b80fb26ba4",
      "contentModel": "canonical-json",
      "mediaType": "application/json",
      "contentSha256": "31f8920a9d4815272dc96b26b9459f218701874c63e9ce0b9536d252c4e83d0e",
      "availability": "bundled",
      "logicalPath": "repo://investigations/backend-agnostic-goal-closure/material/baseline-oracle-gate-execution-pattern-pattern-outcome-bindings-distinguish.json",
      "resolverId": "repo-v1"
    },
    {
      "role": "baseline-oracle-gate-result",
      "digest": "1f96de528bbe582c84d828abfe205d51a51a0cbc92f65207d7e6a96f5c7e46c2",
      "contentModel": "canonical-json",
      "mediaType": "application/json",
      "contentSha256": "c2ec805fdfca2a00a139d354a3d6eb81e7f47912f9a31f5bacce5f9abf092256",
      "availability": "bundled",
      "logicalPath": "repo://investigations/backend-agnostic-goal-closure/material/baseline-oracle-gate-concrete-output-ordered-output-utf8-lines-distinguish.json",
      "resolverId": "repo-v1"
    },
    {
      "role": "baseline-oracle-gate-result",
      "digest": "26ed542157b2c880a0a240b20150c344e1cc4786db1638168a50e73177556cd3",
      "contentModel": "canonical-json",
      "mediaType": "application/json",
      "contentSha256": "897ea49a30124251bc9e30af465cf0fd4e4237a0f70affb97911a6fbeafd4b26",
      "availability": "bundled",
      "logicalPath": "repo://investigations/backend-agnostic-goal-closure/material/baseline-oracle-gate-final-result-whole-portable-term-agree.json",
      "resolverId": "repo-v1"
    },
    {
      "role": "baseline-oracle-gate-result",
      "digest": "2da36f977da95c7686a5a22fb82e9abc586f34a4245cca688810a08708a4ab3b",
      "contentModel": "canonical-json",
      "mediaType": "application/json",
      "contentSha256": "9388fa059e50290554e3d24430dc6a032104144a1e71045fa84a0334fce676c6",
      "availability": "bundled",
      "logicalPath": "repo://investigations/backend-agnostic-goal-closure/material/baseline-oracle-gate-concrete-output-ordered-output-bytes-agree.json",
      "resolverId": "repo-v1"
    },
    {
      "role": "baseline-oracle-gate-result",
      "digest": "351070cf285fa6436e88183931dad365ce0198b4209231a901fd95d8ff9cd086",
      "contentModel": "canonical-json",
      "mediaType": "application/json",
      "contentSha256": "6171a2d13da2905e5a1a9d502fd5fc252c593e42dbe6150ac5a4139242d99ffe",
      "availability": "bundled",
      "logicalPath": "repo://investigations/backend-agnostic-goal-closure/material/baseline-oracle-gate-final-result-whole-portable-term-distinguish.json",
      "resolverId": "repo-v1"
    },
    {
      "role": "baseline-oracle-gate-result",
      "digest": "383febe7fd2ecc1bf2566b49c242fdb2a20a1a885eab72c5dba783432bb9a4b9",
      "contentModel": "canonical-json",
      "mediaType": "application/json",
      "contentSha256": "62c67603629ee19cd2a973c80fa1fd25fa90c7f6a02f446ece2b0579085dc86b",
      "availability": "bundled",
      "logicalPath": "repo://investigations/backend-agnostic-goal-closure/material/baseline-oracle-gate-structured-predicate-predicate-bool-agree.json",
      "resolverId": "repo-v1"
    },
    {
      "role": "baseline-oracle-gate-result",
      "digest": "4cc47e3f1ac14dc6eed39d479c67b5591e1190316c844a02bb9288b37e7d1e35",
      "contentModel": "canonical-json",
      "mediaType": "application/json",
      "contentSha256": "6373b5340071182a231732e227361060c905030617fe4c51471e2708cda33b05",
      "availability": "bundled",
      "logicalPath": "repo://investigations/backend-agnostic-goal-closure/material/baseline-oracle-gate-structured-predicate-unknown.json",
      "resolverId": "repo-v1"
    },
    {
      "role": "baseline-oracle-gate-result",
      "digest": "6c242aaa4b03e722691543dc2b8a22a274f1048a9688bf5ed786b1fb28ceca4c",
      "contentModel": "canonical-json",
      "mediaType": "application/json",
      "contentSha256": "6459b1a1e88544f7460fb507e41c158175b067d78829578adf7d9c259631b3b3",
      "availability": "bundled",
      "logicalPath": "repo://investigations/backend-agnostic-goal-closure/material/baseline-oracle-gate-execution-pattern-pattern-outcome-agree.json",
      "resolverId": "repo-v1"
    },
    {
      "role": "baseline-oracle-gate-result",
      "digest": "70962a9fbd086f2e0c98baad2509ec86fed7a4de59d61707972b677247817665",
      "contentModel": "canonical-json",
      "mediaType": "application/json",
      "contentSha256": "29f95c9a5fa1d370c5cb8371c65f1f59886c3dcf7d4da4a825c468bf7ab1a117",
      "availability": "bundled",
      "logicalPath": "repo://investigations/backend-agnostic-goal-closure/material/baseline-oracle-gate-reachability-unknown.json",
      "resolverId": "repo-v1"
    },
    {
      "role": "baseline-oracle-gate-result",
      "digest": "72bb241a54379419850be364ceb04ad1664af01df76bdfe15095e24ce453ceeb",
      "contentModel": "canonical-json",
      "mediaType": "application/json",
      "contentSha256": "204d88c411a73e3f6ca0568912628d7f700a83b237a8c35b82b2e1509b4ce409",
      "availability": "bundled",
      "logicalPath": "repo://investigations/backend-agnostic-goal-closure/material/baseline-oracle-gate-concrete-output-ordered-output-utf8-lines-agree.json",
      "resolverId": "repo-v1"
    },
    {
      "role": "baseline-oracle-gate-result",
      "digest": "792407023d44dae7d19e4bb783bb33f56083c27bf11deb58721343e736b61e44",
      "contentModel": "canonical-json",
      "mediaType": "application/json",
      "contentSha256": "57f0bdddc75f81c3314209ea85756898211fd897960b54ee5f152af2cf2746d1",
      "availability": "bundled",
      "logicalPath": "repo://investigations/backend-agnostic-goal-closure/material/baseline-oracle-gate-exit-stop-terminal-class-and-declared-exit-distinguish.json",
      "resolverId": "repo-v1"
    },
    {
      "role": "baseline-oracle-gate-result",
      "digest": "a2eff0a8b026e72f0ca0f6224c788dc51086c2807c5757397115f10ac751a8fa",
      "contentModel": "canonical-json",
      "mediaType": "application/json",
      "contentSha256": "de5f64bda13717dd43344fda2d9bea3fc0d08f099dd10f06c3a2c10303b4ab8d",
      "availability": "bundled",
      "logicalPath": "repo://investigations/backend-agnostic-goal-closure/material/baseline-oracle-gate-incomparable-baseline-crash.json",
      "resolverId": "repo-v1"
    },
    {
      "role": "baseline-oracle-gate-result",
      "digest": "abcc46ea600c47e64ec219b1839dc338b0cb4485246898bea0fe4b9f542fbd78",
      "contentModel": "canonical-json",
      "mediaType": "application/json",
      "contentSha256": "e521cb1b5f2ae4cbe4514f14738a18dd7471504df05669407d1bce1fc97af1e3",
      "availability": "bundled",
      "logicalPath": "repo://investigations/backend-agnostic-goal-closure/material/baseline-oracle-gate-structured-predicate-predicate-bool-distinguish.json",
      "resolverId": "repo-v1"
    },
    {
      "role": "baseline-oracle-gate-result",
      "digest": "aebbfefc256bbfae20ba26686fc916f07a5eff7696d248c6e6018b35b1c4af13",
      "contentModel": "canonical-json",
      "mediaType": "application/json",
      "contentSha256": "dacbbd1321162c08f9cc8c47cb5c27f3c8983054cea9d0239779fc82206aa35e",
      "availability": "bundled",
      "logicalPath": "repo://investigations/backend-agnostic-goal-closure/material/baseline-oracle-gate-execution-pattern-pattern-outcome-bindings-agree.json",
      "resolverId": "repo-v1"
    },
    {
      "role": "baseline-oracle-gate-result",
      "digest": "e3b41eb471796770c67dd8bb2a0e5d29346544da99eebcc8c05b0b29163044dc",
      "contentModel": "canonical-json",
      "mediaType": "application/json",
      "contentSha256": "f17ad31eb1db36acef1da8deb7d5810c2bee7f4f010cbafe9adf792499ed532b",
      "availability": "bundled",